<?xml version="1.0" encoding="UTF-8"?>
<!--Sample XML file generated by XMLSpy v2010 (http://www.altova.com)-->
<tk:Toolkit version="2.0" xsi:schemaLocation="http://www.qdocuments.net ../../schema/v5/WfCreator.xsd" xmlns:tk="http://www.qdocuments.net" xmlns:xsi="http://www.w3.org/2001/XMLSchema-instance">
  <tk:Creator RegName="TestBegin2">
    <tk:WorkflowName>DataSetExtension.GetString(row, 'BillNo')</tk:WorkflowName>
    <tk:Content IsMain="true">
      <tk:Resolver>
        <tk:DataXmlResolver DataXml="TestWf/Requirement.xml" AutoTrackField="true" AutoUpdateKey="true"/>
      </tk:Resolver>
      <tk:Record>
        <tk:Key ParamName="Id" NickName="Id"/>
      </tk:Record>
    </tk:Content>
  </tk:Creator>
</tk:Toolkit>
